### ISSUE TITLE
Error contacting the API at http://localhost:5417/login

### ISSUE THREAD

**Issue by aditaa** [Lothiraldan/saltpad#145]
saltpad is having an issue with login:

if i test against the salt-api i can login
```bash
[root@salt ~]# curl -i -H accept=application/json -d username=salt -d password=salt -d eauth=pam http://localhost:5417/login
HTTP/1.1 200 OK
Date: Fri, 25 Mar 2016 15:14:30 GMT
Content-Length: 186
Content-Type: application/json
Server: TornadoServer/4.2.1

{"return": [{"perms": [".*", "@runner", "@wheel"], "start": 1458918870.155475, "token": "7c6e4a11ad6907b02637acc2f886755f", "expire": 1458962070.155477, "user": "salt", "eauth": "pam"}]}
```

but if i try to login via saltpad 
![image](https://cloud.githubusercontent.com/assets/3939110/14047345/627e447c-f275-11e5-819d-fcf2bc5c34da.png)

and nothing outputs to the httpd log

**Comment by aditaa** [comment]
debug console outout:

```
xhr.js:134 OPTIONS http://localhost:5417/login net::ERR_CONNECTION_REFUSEDe.exports @ xhr.js:134(anonymous function) @ dispatchRequest.js:15e.exports @ dispatchRequest.js:11
AuthService.js:41 Uncaught (in promise) Error: Error contacting the API at http://localhost:5417/login(…)(anonymous function) @ AuthService.js:41
```

**Comment by Ferbla** [comment]
Hello Aditaa,

I had a similar issue, I ended up changing API_URL from localhost in the settings.json file to the IP of the server. 

The problem for me was when the browser looked at the API_URL, but once it looked at the server instead of localhost it could talk to the API.

Hope that helps.

**Comment by Lothiraldan** [comment]
From where did you tried the curl call? It should be tested on your personal computer where the browser will run. It's the main difference between an application that runs in the browser (saltpad v2) and an application that runs in the server (saltpad v1), @Ferbla your solution is right, your browser need access to salt-api.

**Comment by szepeviktor** [comment]
This is my tcpdump
```
20:56:28.707224 IP (tos 0x0, ttl 64, id 448, offset 0, flags [DF], proto TCP (6), length 467)
    localhost.36440 > localhost.5417: Flags [P.], cksum 0xffc7 (incorrect -> 0x9b9d), seq 2993911822:2993912237, ack 3524063124, win 375, options [nop,nop,TS val 3226989 ecr 3202313], length 415
E.....@.@.9c.........X.).sx........w.......
.1=m.0. OPTIONS /login HTTP/1.1
Host: localhost:5417
User-Agent: Mozilla/5.0 (Windows NT 10.0; Win64; x64; rv:45.0) Gecko/20100101 Firefox/45.0
Accept: text/html,application/xhtml+xml,application/xml;q=0.9,*/*;q=0.8
Accept-Language: en-US,en;q=0.5
Accept-Encoding: gzip, deflate
Access-Control-Request-Method: POST
Access-Control-Request-Headers: content-type
Origin: http://localhost:81
Connection: keep-alive


20:56:28.708493 IP (tos 0x0, ttl 64, id 39880, offset 0, flags [DF], proto TCP (6), length 288)
    localhost.5417 > localhost.36440: Flags [P.], cksum 0xff14 (incorrect -> 0x36b8), seq 1:237, ack 415, win 384, options [nop,nop,TS val 3226989 ecr 3226989], length 236
E.. ..@.@............).X.....sy............
.1=m.1=mHTTP/1.1 406 Not Acceptable
Date: Fri, 01 Apr 2016 00:56:28 GMT
Content-Length: 79
Content-Type: text/html; charset=UTF-8
Server: TornadoServer/4.2.1

<html><title>406: Not Acceptable</title><body>406: Not Acceptable</body></html>
20:56:28.708519 IP (tos 0x0, ttl 64, id 449, offset 0, flags [DF], proto TCP (6), length 52)
    localhost.36440 > localhost.5417: Flags [.], cksum 0xfe28 (incorrect -> 0x69ce), ack 237, win 384, options [nop,nop,TS val 3226989 ecr 3226989], length 0
E..4..@.@.;..........X.).sy..........(.....
.1=m.1=m


```

**Comment by aditaa** [comment]
not using localhost solved this for me
